{"$defs":{"CausalDigest":{"pattern":"^[0-9a-f]{64}$","type":"string"},"ContentID":{"pattern":"^[0-9a-f]{64}$","type":"string"},"bounded_utf8_registry_string":{"maxLength":128,"minLength":1,"type":"string"},"bounded_utf8_registry_string_256":{"maxLength":256,"minLength":1,"type":"string"},"i128s":{"pattern":"^(0|-?[1-9][0-9]*)$","type":"string"},"rfc3339_full_date":{"pattern":"^[0-9]{4}-[0-9]{2}-[0-9]{2}$","type":"string"},"rfc3339_ns_utc":{"pattern":"^[0-9]{4}-[0-9]{2}-[0-9]{2}T[0-9]{2}:[0-9]{2}:[0-9]{2}\\.[0-9]{9}Z$","type":"string"},"safe_relative_path":{"pattern":"^(?![A-Za-z]:)(?!/)(?!\\.{1,2}(?:/|$))(?!.*(?:/\\.{1,2})(?:/|$))(?!.*//)[^/\\\\:\\x00]+(?:/[^/\\\\:\\x00]+)*$","type":"string"},"sha256":{"pattern":"^[0-9a-f]{64}$","type":"string"},"sq18s":{"pattern":"^(0|-?[1-9][0-9]*)$","type":"string"},"u64s":{"pattern":"^(0|[1-9][0-9]*)$","type":"string"},"uints":{"pattern":"^(0|[1-9][0-9]*)$","type":"string"},"uq18s":{"pattern":"^(0|[1-9][0-9]*)$","type":"string"}},"$id":"urn:build-finance:contract:portfolio-state:v1","$schema":"https://json-schema.org/draft/2020-12/schema","additionalProperties":false,"properties":{"as_of_ingest_sequence":{"$ref":"#/$defs/u64s"},"balances":{"items":{"additionalProperties":false,"properties":{"available_atoms":{"$ref":"#/$defs/u64s"},"decimals":{"maximum":18,"minimum":0,"type":"integer"},"mint":{"$ref":"#/$defs/bounded_utf8_registry_string"},"reserved_atoms":{"$ref":"#/$defs/u64s"},"total_atoms":{"$ref":"#/$defs/u64s"}},"required":["mint","decimals","available_atoms","reserved_atoms","total_atoms"],"type":"object"},"type":"array","uniqueItems":true},"causation_id":{"$ref":"#/$defs/CausalDigest"},"causation_schema":{"enum":["RUN_INITIALIZATION","GROUP_MARK_TO_MARKET","trading.simulated-order-intent/v1","trading.simulated-fill-receipt/v1","RISK_KILL"]},"config_admission_receipt_id":{"$ref":"#/$defs/ContentID"},"equal_time_group":{"$ref":"#/$defs/u64s"},"fixture_manifest_sha256":{"$ref":"#/$defs/ContentID"},"kill_latched":{"type":"boolean"},"kill_reason_codes":{"items":{"enum":["RISK_CONFIG_MISSING","RISK_CONFIG_INVALID","RISK_SEQUENCE_INVALID","RISK_STATE_UNRECONCILED","RISK_DECIMALS_MISMATCH","RISK_ARITHMETIC_RANGE","RISK_NONPOSITIVE_EQUITY","RISK_SESSION_LOSS","RISK_DRAWDOWN","RISK_RESERVATION_CONFLICT","RECONCILIATION_IDEMPOTENCY_CONFLICT","RECONCILIATION_MODEL_ATTEMPT_INTEGRITY","RECONCILIATION_EXECUTION_TRANSITION_INTEGRITY","RECONCILIATION_ARITHMETIC_RANGE","RECONCILIATION_ACCOUNT_RESIDUAL","RECONCILIATION_ASSET_RESIDUAL","RECONCILIATION_PNL_RESIDUAL","RECONCILIATION_FEE_RESIDUAL","RECONCILIATION_EQUITY_RESIDUAL","RECONCILIATION_RESERVATION_RESIDUAL","RECONCILIATION_INTENT_CARDINALITY","RECONCILIATION_INTENT_RESERVATION_BIJECTION","RECONCILIATION_ABSOLUTE_STATE_INVARIANT","RECONCILIATION_RUN_END_UNCLOSED","RECONCILIATION_MISMATCH"]},"maxItems":25,"type":"array","uniqueItems":true},"open_intent_ids":{"items":{"$ref":"#/$defs/ContentID"},"type":"array","uniqueItems":true},"portfolio_state_id":{"$ref":"#/$defs/ContentID"},"positions":{"items":{"additionalProperties":false,"properties":{"base_decimals":{"maximum":18,"minimum":0,"type":"integer"},"base_mint":{"$ref":"#/$defs/bounded_utf8_registry_string"},"cost_basis_quote_atoms":{"$ref":"#/$defs/u64s"},"mark_price_q18":{"$ref":"#/$defs/sq18s"},"market_id":{"$ref":"#/$defs/bounded_utf8_registry_string"},"market_value_quote_atoms":{"$ref":"#/$defs/u64s"},"quantity_base_atoms":{"$ref":"#/$defs/u64s"},"reserved_base_atoms":{"$ref":"#/$defs/u64s"},"stop_price_q18":{"$ref":"#/$defs/sq18s"},"take_price_q18":{"$ref":"#/$defs/sq18s"},"unrealized_pnl_quote_atoms":{"$ref":"#/$defs/i128s"}},"required":["market_id","base_mint","base_decimals","quantity_base_atoms","reserved_base_atoms","cost_basis_quote_atoms","mark_price_q18","market_value_quote_atoms","unrealized_pnl_quote_atoms","stop_price_q18","take_price_q18"],"type":"object"},"type":"array","uniqueItems":true},"previous_portfolio_state_id":{"anyOf":[{"$ref":"#/$defs/ContentID"},{"type":"null"}]},"quote_decimals":{"maximum":18,"minimum":0,"type":"integer"},"quote_mint":{"$ref":"#/$defs/bounded_utf8_registry_string"},"replay_clock_ns":{"$ref":"#/$defs/u64s"},"schema":{"const":"trading.portfolio-state/v1"},"state_sequence":{"$ref":"#/$defs/u64s"},"summary":{"additionalProperties":false,"properties":{"cumulative_fees_quote_atoms":{"$ref":"#/$defs/u64s"},"drawdown_bps":{"maximum":10000,"minimum":0,"type":"integer"},"equity_quote_atoms":{"$ref":"#/$defs/u64s"},"peak_equity_quote_atoms":{"$ref":"#/$defs/u64s"},"realized_pnl_quote_atoms":{"$ref":"#/$defs/i128s"},"session_pnl_quote_atoms":{"$ref":"#/$defs/i128s"},"unrealized_pnl_quote_atoms":{"$ref":"#/$defs/i128s"}},"required":["realized_pnl_quote_atoms","unrealized_pnl_quote_atoms","cumulative_fees_quote_atoms","session_pnl_quote_atoms","equity_quote_atoms","peak_equity_quote_atoms","drawdown_bps"],"type":"object"},"validated_config_sha256":{"anyOf":[{"$ref":"#/$defs/ContentID"},{"type":"null"}]}},"required":["schema","portfolio_state_id","state_sequence","as_of_ingest_sequence","equal_time_group","replay_clock_ns","previous_portfolio_state_id","causation_schema","causation_id","fixture_manifest_sha256","config_admission_receipt_id","validated_config_sha256","quote_mint","quote_decimals","balances","positions","summary","kill_latched","kill_reason_codes","open_intent_ids"],"type":"object","x-contract-schema":"trading.portfolio-state/v1"}
